{
  "schema_version": 1,
  "signer": "eob-reviewed-authority-v1",
  "digest_purpose": "public-sha256-content-integrity-pins",
  "authorities": [
    {"id":"google-source","provider":"google","kind":"source","url":"https://github.com/googleapis/google-api-python-client/tree/4dc2aeca2633476d3d497f2a4368ef91172b378e","immutable_ref":"commit:4dc2aeca2633476d3d497f2a4368ef91172b378e","mutable":false,"title":"google-api-python-client reviewed source","required_assertions":["owner:googleapis","repository:google-api-python-client","commit:4dc2aeca2633476d3d497f2a4368ef91172b378e"],"content_digest":"ca978112ca1bbdcafac231b39a23dc4da786eff8147c4e72b9807785afee48bb"},
    {"id":"google-docs","provider":"google","kind":"documentation","url":"https://developers.google.com/sheets/api","mutable":true,"reviewed_at":"2026-09-05T00:00:00Z","title":"Google Sheets API documentation","required_assertions":["official Google Sheets API documentation"],"content_digest":"3e23e8160039594a33894f6564e1b1348bbd7a0088d42c4acb73eeaed59c009d"},
    {"id":"google-data-policy","provider":"google","kind":"data_policy","url":"https://developers.google.com/terms/api-services-user-data-policy","mutable":true,"reviewed_at":"2026-09-05T00:00:00Z","title":"Google API Services User Data Policy","required_assertions":["Google API Services User Data Policy"],"content_digest":"2e7d2c03a9507ae265ecf5b5356885a53393a2029d241394997265a1a25aefc6"},
    {"id":"google-cost","provider":"google","kind":"cost","url":"https://developers.google.com/sheets/api/limits","mutable":true,"reviewed_at":"2026-09-05T00:00:00Z","title":"Google Sheets API usage limits","required_assertions":["usage limits","quotas"],"content_digest":"18ac3e7343f016890c510e93f935261169d9e3f565436429830faf0934f4f8e4"},
    {"id":"composio-pricing","provider":"composio","kind":"pricing","url":"https://docs.composio.dev/docs/pricing","mutable":true,"reviewed_at":"2026-09-05T00:00:00Z","title":"Composio pricing","required_assertions":["current pricing"],"content_digest":"3f79bb7b435b05321651daefd374cdc681dc06faa65e374e38337b88ca046dea"},
    {"id":"composio-plan","provider":"composio","kind":"plan","url":"https://docs.composio.dev/docs/pricing/plans","mutable":true,"reviewed_at":"2026-09-05T00:00:00Z","title":"Composio plans","required_assertions":["plan limits"],"content_digest":"252f10c83610ebca1a059c0bae8255eba2f95be4d1d7bcfa89d7248a82d9f111"},
    {"id":"composio-tool_limits","provider":"composio","kind":"tool_limits","url":"https://docs.composio.dev/docs/tools/limits","mutable":true,"reviewed_at":"2026-09-05T00:00:00Z","title":"Composio tool limits","required_assertions":["tool limits"],"content_digest":"cd0aa9856147b6c5b4ff2b7dfee5da20aa38253099ef1b4a64aced233c9afe29"},
    {"id":"composio-trigger_limits","provider":"composio","kind":"trigger_limits","url":"https://docs.composio.dev/docs/triggers/limits","mutable":true,"reviewed_at":"2026-09-05T00:00:00Z","title":"Composio trigger limits","required_assertions":["trigger limits"],"content_digest":"aaa9402664f1a41f40ebbc52c9993eb66aeb366602958fdfaa283b71e64db123"},
    {"id":"composio-scopes","provider":"composio","kind":"scopes","url":"https://docs.composio.dev/docs/auth/scopes","mutable":true,"reviewed_at":"2026-09-05T00:00:00Z","title":"Composio scopes","required_assertions":["requested scopes"],"content_digest":"de7d1b721a1e0632b7cf04edf5032c8ecffa9f9a08492152b926f1a5a7e765d7"},
    {"id":"composio-data_policy","provider":"composio","kind":"data_policy","url":"https://composio.dev/privacy","mutable":true,"reviewed_at":"2026-09-05T00:00:00Z","title":"Composio privacy policy","required_assertions":["data handling policy"],"content_digest":"189f40034be7a199f1fa9891668ee3ab6049f82d38c68be70f596eab2e1857b7"},
    {"id":"composio-write_behavior","provider":"composio","kind":"write_behavior","url":"https://docs.composio.dev/docs/tools/executing-tools","mutable":true,"reviewed_at":"2026-09-05T00:00:00Z","title":"Composio tool execution","required_assertions":["write execution behavior"],"content_digest":"8254c329a92850f6d539dd376f4816ee2764517da5e0235514af433164480d7a"}
  ]
}
